{"architecture":{"frozen_components":["neural network model (pre-trained, held fixed)"],"mechanism_tags":["activation-to-concept-mapping","logic-induction","neural-network-explanation","faithfulness-verification"],"seam_cell":"own-activations","summary":"The system takes a trained neural network and induces human-readable logic-based theories by establishing mappings from neuron activations to human-defined concepts. The induced theories are intended to faithfully represent the classification process of the original network. Information flows from neuron activations through concept mappings to produce symbolic logic rules.","trained_components":[]},"biblio":{"authors":["João Ferreira","Manuel de Sousa Ribeiro","Ricardo Gonçalves","João Leite"],"citation_count":{"as_of":"2026-07-09","source":"openalex","value":16},"title":"Looking Inside the Black-Box: Logic-based Explanations for Neural Networks","venue":null,"year":2022},"claims":[{"baseline":null,"claim_id":"c1","compute_reported":false,"dataset":null,"evidence":"claimed","evidence_ref":null,"metric":null,"scale":null,"statement":"The developed procedure induces human-understandable logic-based theories that attempt to represent the classification process of a given neural network model by establishing mappings from neuron activation values to human-defined concepts","type":"qualitative","unit":null,"value":null},{"baseline":null,"claim_id":"c2","compute_reported":false,"dataset":null,"evidence":"claimed","evidence_ref":null,"metric":null,"scale":null,"statement":"The theories developed through the method are faithful to the representations learned by the neural networks that they are built to describe","type":"qualitative","unit":null,"value":null},{"baseline":null,"claim_id":"c3","compute_reported":false,"dataset":"synthetic image classification task","evidence":"claimed","evidence_ref":null,"metric":null,"scale":null,"statement":"Empirical results assess the quality of the developed theories for different neural network models on a synthetic image classification task","type":"qualitative","unit":null,"value":null}],"id":"doi:10.24963/kr.2022/45","identity":{"arxiv":null,"doi":"10.24963/kr.2022/45","openalex":"W4288046801","pdf_sha256":null,"s2":null},"provenance":{"audit":{"by":null,"state":"UNAUDITED"},"extracted_at":"2026-07-09T11:07:08Z","extractor_model":"claude-haiku-4-5-20251001","prompt_sha256":"9ad194037f51cd9237f22f7acdeb8479a7170cd5b516d55dd5fdfcba9bd44dc3","source_scope":"abstract-only"},"record_sha256":"bb7f186c3bbeabb78a92d91759516a09356c3de893130c3a7cccd5275bc0cdce","relation_to_kernel":{"hypotheses":[],"ledger_refs":[],"note":null,"seams":[]},"reproduction":{"code_url":null,"weights_url":null},"schema_version":"kot-lit/1"}
