{"architecture":{"frozen_components":[],"mechanism_tags":["neuro-symbolic","object-detection","textual-grounding","compositional-reasoning","prompt-guided","scene-understanding"],"seam_cell":"trained-bridge","summary":"A neuro-symbolic object detection framework that integrates a deep learning module for aligning object proposals with textual prompts and a symbolic module for logical reasoning. The system processes images and textual queries together, using deep learning to ground language in visual features while enabling compositional query understanding through symbolic reasoning over detected objects and their attributes.","trained_components":["deep learning module for prompt-object alignment","vision encoder for object proposal extraction"]},"biblio":{"authors":["Silvan Ferreira","Allan Martins","Daniel G. Costa","Ivanovitch Silva"],"citation_count":{"as_of":"2026-07-09","source":"openalex","value":2},"title":"Integrating Textual Queries with AI-Based Object Detection: A Compositional Prompt-Guided Approach","venue":"Sensors","year":2025},"claims":[{"baseline":null,"claim_id":"c1","compute_reported":false,"dataset":"synthetic 3D image dataset","evidence":"claimed","evidence_ref":null,"metric":null,"scale":null,"statement":"The framework effectively generalizes to complex queries, combining simple attribute-based descriptions without explicit training on compound prompts","type":"qualitative","unit":null,"value":null},{"baseline":null,"claim_id":"c2","compute_reported":false,"dataset":null,"evidence":"claimed","evidence_ref":null,"metric":null,"scale":null,"statement":"By integrating deep learning with symbolic reasoning, object detection and scene understanding are considerably enhanced, enabling complex, query-driven interactions","type":"qualitative","unit":null,"value":null}],"id":"doi:10.3390/s25072258","identity":{"arxiv":null,"doi":"10.3390/s25072258","openalex":"W4409145140","pdf_sha256":null,"s2":null},"provenance":{"audit":{"by":null,"state":"UNAUDITED"},"extracted_at":"2026-07-09T13:31:30Z","extractor_model":"claude-haiku-4-5-20251001","prompt_sha256":"9ad194037f51cd9237f22f7acdeb8479a7170cd5b516d55dd5fdfcba9bd44dc3","source_scope":"abstract-only"},"record_sha256":"1efde411cf6e870edcf068ace6df41a52f947df4ab374cc6b1e9708fe7f60d7c","relation_to_kernel":{"hypotheses":[],"ledger_refs":[],"note":null,"seams":[]},"reproduction":{"code_url":null,"weights_url":null},"schema_version":"kot-lit/1"}
