{"architecture":{"frozen_components":["LLM backbone"],"mechanism_tags":["tree-of-thought","constrained-decoding","prompting","reasoning-paths","vocabulary-grounding"],"seam_cell":"external-engine","summary":"StoC-ToT is a prompting framework for multi-hop question answering that constructs a tree of reasoning paths by prompting an LLM to generate sub-questions at each reasoning level, answer them using constrained decoding from a vocabulary bank built from evidence, estimate validity probabilities for each path across question/reasoning/answer levels, and aggregate path probabilities to select the best answer. For closed-source LLMs, constraints are enforced via prompting; for open-source LLMs, a logit processor sets non-vocabulary tokens to negative infinity at decode time.","trained_components":[]},"biblio":{"authors":[],"title":"STOC-TOT: Stochastic Tree-of-Thought with Constrained Decoding for Complex Reasoning in Multi-Hop Question Answering","venue":null,"year":2024},"claims":[{"baseline":{"name":"Tree-of-Thought","value":null},"claim_id":"c1","compute_reported":false,"dataset":"HotpotQA","evidence":"claimed","evidence_ref":null,"metric":"Exact Match / F1","scale":null,"statement":"StoC-ToT with GPT-4 improves Exact Match accuracy by 7% and F1 score by 7.8 points over original tree-of-thought prompting on the HotpotQA dataset","type":"quantitative","unit":"percent / points","value":7.0},{"baseline":{"name":"Zero-Shot Vanilla","value":null},"claim_id":"c2","compute_reported":false,"dataset":"HotpotQA","evidence":"claimed","evidence_ref":null,"metric":"Exact Match","scale":null,"statement":"On HotpotQA, StoC-ToT attains an on-average increase in performance of over 6% compared with vanilla prompting on GPT models, and the improvement goes up to 11% when constrained decoding is implemented","type":"quantitative","unit":"percent","value":11.0},{"baseline":{"name":"Zero-Shot Vanilla","value":31.5},"claim_id":"c3","compute_reported":false,"dataset":"MuSiQue","evidence":"claimed","evidence_ref":null,"metric":"Exact Match","scale":null,"statement":"On the MuSiQue dataset with GPT-4, StoC-ToT shows an 11.5% EM improvement (from 31.50 to 42.0) over zero-shot vanilla prompting","type":"quantitative","unit":"percent","value":11.5},{"baseline":{"name":"Tree-of-Thought","value":null},"claim_id":"c4","compute_reported":false,"dataset":"HotpotQA and MuSiQue","evidence":"claimed","evidence_ref":null,"metric":"Exact Match","scale":null,"statement":"StoC-ToT surpasses the original Tree-of-Thought prompting by 7% with the GPT4 model on both tested datasets","type":"quantitative","unit":"percent","value":7.0},{"baseline":null,"claim_id":"c5","compute_reported":false,"dataset":null,"evidence":"claimed","evidence_ref":null,"metric":null,"scale":null,"statement":"Constrained decoding, which makes the model much more grounded to evidence when answering the question, effectively addresses hallucination issues and improves the overall performance of the framework","type":"qualitative","unit":null,"value":null},{"baseline":null,"claim_id":"c6","compute_reported":false,"dataset":"HotpotQA","evidence":"claimed","evidence_ref":null,"metric":null,"scale":null,"statement":"StoC-ToT performs better at both Bridge Questions and Sequential Questions, suggesting that it can avoid reasoning dead-ends and is better at forming intermediate reasoning lines than Chain-of-Thought and Tree-of-Thought","type":"qualitative","unit":null,"value":null},{"baseline":null,"claim_id":"c7","compute_reported":false,"dataset":"HotpotQA","evidence":"claimed","evidence_ref":null,"metric":null,"scale":null,"statement":"StoC-ToT performs better on both reasoning types, especially on questions containing parallel reasoning, suggesting that its stochastic way of forming the tree is very effective when solving questions containing multiple reasoning paths","type":"qualitative","unit":null,"value":null},{"baseline":null,"claim_id":"c8","compute_reported":false,"dataset":null,"evidence":"claimed","evidence_ref":null,"metric":null,"scale":null,"statement":"The framework relies on initiating multiple model instances and requires multiple prompts per round, imposing heavy time costs even after implementing the paraphrase module","type":"negative","unit":null,"value":null}],"id":"arxiv:2407.03687","identity":{"arxiv":"2407.03687","doi":null,"openalex":null,"pdf_sha256":null,"s2":null},"provenance":{"audit":{"by":null,"state":"UNAUDITED"},"extracted_at":"2026-07-09T03:45:03Z","extractor_model":"claude-haiku-4-5-20251001","prompt_sha256":"9ad194037f51cd9237f22f7acdeb8479a7170cd5b516d55dd5fdfcba9bd44dc3","source_scope":"fulltext"},"record_sha256":"c5f47c471b750a29c614dbbce3aabda71836448b10d70c1467d16dce330c076e","relation_to_kernel":{"hypotheses":[],"ledger_refs":[],"note":null,"seams":[]},"reproduction":{"code_url":null,"weights_url":null},"schema_version":"kot-lit/1"}
