{"architecture":{"frozen_components":["FlatASCEND clinical sequence model (14.5M parameters)"],"mechanism_tags":["sae","activation-analysis","clinical-nlp","interpretability","probing","intervention"],"seam_cell":"own-activations","summary":"The system applies sparse autoencoders (TopK SAEs) to FlatASCEND, a 14.5M-parameter autoregressive clinical sequence model trained on EHR data. SAEs decompose residual stream activations at all 10 transformer depth layers into interpretable sparse features. Information flows from EHR tokens through the frozen clinical model, whose activations are read by trained SAE encoders that project into a learned sparse dictionary space, then reconstructed; downstream analysis applies linear probes and intervention methods (delta-mode perturbation) to probe feature-level representations for clinical tasks.","trained_components":["TopK sparse autoencoders (one per residual stream layer)","linear probes for mortality and length-of-stay prediction"]},"biblio":{"authors":["Chris Sainsbury","Feng Dong","Andreas Karwath"],"citation_count":{"as_of":"2026-07-09","source":"openalex","value":0},"title":"Sparse Autoencoder Decomposition of Clinical Sequence Model Representations: Feature Complexity, Task Specialisation, and Mortality Prediction","venue":"arXiv (Cornell University)","year":2026},"claims":[{"baseline":null,"claim_id":"c1","compute_reported":false,"dataset":"INSPECT (outpatient) and MIMIC-IV (ICU)","evidence":"claimed","evidence_ref":null,"metric":null,"scale":null,"statement":"SAE decomposition reveals progressive abstraction across transformer depth: layer-0 features are near-perfect token detectors while layer-6 features span approximately 30 token types across multiple clinical categories","type":"qualitative","unit":null,"value":null},{"baseline":null,"claim_id":"c2","compute_reported":false,"dataset":"INSPECT and MIMIC-IV","evidence":"claimed","evidence_ref":null,"metric":"singleton feature percentage","scale":{"params":14500000.0,"rungs_measured":null},"statement":"Layer-0 features are near-perfect token detectors with 45.7% singleton features","type":"quantitative","unit":"percent","value":45.7},{"baseline":null,"claim_id":"c3","compute_reported":false,"dataset":"INSPECT and MIMIC-IV","evidence":"claimed","evidence_ref":null,"metric":"singleton feature percentage","scale":{"params":14500000.0,"rungs_measured":null},"statement":"Layer-6 features have 0.5% singleton features","type":"quantitative","unit":"percent","value":0.5},{"baseline":{"name":"dense representations","value":null},"claim_id":"c4","compute_reported":false,"dataset":null,"evidence":"claimed","evidence_ref":null,"metric":null,"scale":null,"statement":"SAE features outperform dense representations for discrete event prediction (mortality) under full-sequence simple linear probes, but dense representations outperform for continuous magnitude prediction (length of stay)","type":"qualitative","unit":null,"value":null},{"baseline":{"name":"dense representations","value":0.88},"claim_id":"c5","compute_reported":false,"dataset":"eICU-CRD","evidence":"claimed","evidence_ref":null,"metric":"AUC","scale":{"params":14500000.0,"rungs_measured":null},"statement":"In clinically relevant leakage-safe windows, dense representations match or exceed SAE features across all tested settings: eICU-CRD 48-hour mortality AUC SAE 0.871 versus dense 0.880","type":"quantitative","unit":"fraction","value":0.871},{"baseline":{"name":"dense representations","value":0.914},"claim_id":"c6","compute_reported":false,"dataset":"MIMIC-IV","evidence":"claimed","evidence_ref":null,"metric":"AUC","scale":{"params":14500000.0,"rungs_measured":null},"statement":"MIMIC-IV mortality AUC: SAE 0.836 versus dense 0.914","type":"quantitative","unit":"fraction","value":0.836},{"baseline":{"name":"dense representations","value":0.8},"claim_id":"c7","compute_reported":false,"dataset":"INSPECT","evidence":"claimed","evidence_ref":null,"metric":"AUC","scale":{"params":14500000.0,"rungs_measured":null},"statement":"INSPECT 1-year/3-year mortality AUC: SAE 0.697 versus dense 0.800","type":"quantitative","unit":"fraction","value":0.697},{"baseline":null,"claim_id":"c8","compute_reported":false,"dataset":"INSPECT and MIMIC-IV","evidence":"claimed","evidence_ref":null,"metric":null,"scale":null,"statement":"Feature reproducibility across random seeds is 21%, and individual features should be interpreted as illustrative rather than stable. Delta-mode intervention effects are larger than random controls in 3 of 4 conditions but not formally significant","type":"negative","unit":null,"value":null}],"id":"url:openalex-w7160670856","identity":{"arxiv":null,"doi":null,"openalex":"W7160670856","pdf_sha256":null,"s2":null},"provenance":{"audit":{"by":null,"state":"UNAUDITED"},"extracted_at":"2026-07-09T13:33:36Z","extractor_model":"claude-haiku-4-5-20251001","prompt_sha256":"9ad194037f51cd9237f22f7acdeb8479a7170cd5b516d55dd5fdfcba9bd44dc3","source_scope":"abstract-only"},"record_sha256":"0e788d325d29341cb50f23dc8e24f2029104aeb3e106856d0aee9f5f835d6456","relation_to_kernel":{"hypotheses":[],"ledger_refs":[],"note":null,"seams":[]},"reproduction":{"code_url":null,"weights_url":null},"schema_version":"kot-lit/1"}
