{"architecture":{"frozen_components":["LLM backbone"],"mechanism_tags":["memory-augmented","dual-process","context-refinement","retrieval","curation-gate","long-term-memory"],"seam_cell":"trained-bridge","summary":"Dual-Process Agent (DPA) is a framework that enables continual learning in frozen LLMs through a two-stage memory-based mechanism. System 1 (fast) retrieves relevant context from explicit long-term memory and generates responses; System 2 (slow) reflects on interaction outcomes and writes curated updates back into memory. Memory is maintained as bulletized entries with utility statistics, and insertions are filtered by a conservative curator gate to prevent degradation. The model backbone remains frozen; all adaptation occurs in the external memory layer.","trained_components":["curator gate"]},"biblio":{"authors":["Liangyu Teng","Wei Ni","Liang Song","Jun Shi","Yanfei Li"],"citation_count":{"as_of":"2026-07-09","source":"openalex","value":0},"title":"Towards Self-Evolving Agents: A Dual-Process Framework for Continual Context Refinement","venue":"Electronics","year":2026},"claims":[{"baseline":null,"claim_id":"c1","compute_reported":false,"dataset":null,"evidence":"claimed","evidence_ref":null,"metric":null,"scale":null,"statement":"DPA decomposes each interaction episode into two complementary processes: a fast System 1 that retrieves compact, relevant context from an explicit long-term memory and generates responses, and a slow System 2 that reflects on outcomes and writes curated updates back into memory.","type":"qualitative","unit":null,"value":null},{"baseline":null,"claim_id":"c2","compute_reported":false,"dataset":null,"evidence":"claimed","evidence_ref":null,"metric":null,"scale":null,"statement":"DPA maintains bulletized memory entries with utility statistics and employs a conservative curator gate that filters generic, redundant, or conflicting insertions to prevent memory degradation over extended interactions.","type":"qualitative","unit":null,"value":null},{"baseline":null,"claim_id":"c3","compute_reported":false,"dataset":null,"evidence":"claimed","evidence_ref":null,"metric":null,"scale":null,"statement":"DPA enables learning without modifying a frozen model backbone.","type":"qualitative","unit":null,"value":null},{"baseline":{"name":"vanilla prompting and competitive baselines","value":null},"claim_id":"c4","compute_reported":false,"dataset":null,"evidence":"claimed","evidence_ref":null,"metric":null,"scale":{"params":null,"rungs_measured":2},"statement":"DPA consistently outperforms vanilla prompting and competitive baselines on both GPT-5.1 and Llama-3.1-8B backbones, achieving the best overall performance across multiple reasoning and knowledge-intensive tasks.","type":"qualitative","unit":null,"value":null}],"id":"doi:10.3390/electronics15061232","identity":{"arxiv":null,"doi":"10.3390/electronics15061232","openalex":"W7136174785","pdf_sha256":null,"s2":null},"provenance":{"audit":{"by":null,"state":"UNAUDITED"},"extracted_at":"2026-07-09T13:34:27Z","extractor_model":"claude-haiku-4-5-20251001","prompt_sha256":"9ad194037f51cd9237f22f7acdeb8479a7170cd5b516d55dd5fdfcba9bd44dc3","source_scope":"abstract-only"},"record_sha256":"5f7ad20e5b10b9424ca6bd946681c758f5ba713b093efdfc861f7bc74cfa8e8c","relation_to_kernel":{"hypotheses":[],"ledger_refs":[],"note":null,"seams":[]},"reproduction":{"code_url":null,"weights_url":null},"schema_version":"kot-lit/1"}
