{"architecture":{"frozen_components":[],"mechanism_tags":["nlp-parsing","grounding","ontology-interface","knowledge-retrieval","activity-simulation","human-computation"],"seam_cell":"text","summary":"A processing pipeline for converting natural language household robot directions into executable simulation plans. The system uses SOMA (Socio-physical Model of Activities) as a shared ontological interface connecting: a natural language parser, a grounding module, reasoning steps that formulate simulation plans guided by human-computed data, and a virtual environment simulator. Symbolic knowledge from a central knowledge base (containing asserted facts, direction semantics, contextual knowledge, and annotated activity models) is retrieved and combined with sub-symbolic annotated models across all components.","trained_components":[]},"biblio":{"authors":["Sebastian Höffner","Robert Porzel","Maria M. Hedblom","Mihai Pomarlan","Vanja Sophie Cangalovic","Johannes Pfau","John Bateman","Rainer Malaka"],"citation_count":{"as_of":"2026-07-09","source":"openalex","value":2},"title":"Deep understanding of everyday activity commands for household robots","venue":"Semantic Web","year":2022},"claims":[{"baseline":null,"claim_id":"c1","compute_reported":false,"dataset":null,"evidence":"claimed","evidence_ref":null,"metric":null,"scale":null,"statement":"The pipeline includes a natural language parser and a module for natural language grounding, with several reasoning steps that formulate simulation plans in which robot actions are guided by data gathered using human computation","type":"qualitative","unit":null,"value":null},{"baseline":null,"claim_id":"c2","compute_reported":false,"dataset":null,"evidence":"claimed","evidence_ref":null,"metric":null,"scale":null,"statement":"Employing an overarching ontological framework (SOMA) allows asserted facts to be stored alongside the semantics of directions, contextual knowledge, and annotated activity models in one central knowledge base","type":"qualitative","unit":null,"value":null},{"baseline":null,"claim_id":"c3","compute_reported":false,"dataset":null,"evidence":"claimed","evidence_ref":null,"metric":null,"scale":null,"statement":"The unified knowledge base provides flexibility and reasoning capabilities as symbolic knowledge is combined with annotated sub-symbolic models","type":"qualitative","unit":null,"value":null}],"id":"doi:10.3233/sw-222973","identity":{"arxiv":null,"doi":"10.3233/sw-222973","openalex":"W4280533308","pdf_sha256":null,"s2":null},"provenance":{"audit":{"by":null,"state":"UNAUDITED"},"extracted_at":"2026-07-09T11:07:13Z","extractor_model":"claude-haiku-4-5-20251001","prompt_sha256":"9ad194037f51cd9237f22f7acdeb8479a7170cd5b516d55dd5fdfcba9bd44dc3","source_scope":"abstract-only"},"record_sha256":"04e343d537973cf138b2a902df2940c3af3b62d41f02fb45c6b3bada194ce423","relation_to_kernel":{"hypotheses":[],"ledger_refs":[],"note":null,"seams":[]},"reproduction":{"code_url":null,"weights_url":null},"schema_version":"kot-lit/1"}
