{"architecture":{"frozen_components":["LLM parameters","VSA algebraic operations (binding, bundling, sign cleanup)","Goal Key and Safe Value vectors (generated offline, not updated)"],"mechanism_tags":["vsa","hyperdimensional-computing","safety-signal-recovery","context-drift-mitigation","external-memory","codebook-retrieval","design-time-contract"],"seam_cell":"trained-bridge","summary":"Holographic Invariant Storage (HIS) is a Vector Symbolic Architecture (VSA) protocol that encodes safety constraints as bipolar hypervectors in high-dimensional space, stores them in external memory, and recovers them via algebraic operations (binding, bundling, cleanup via sign function) when the context window becomes corrupted by accumulated interaction history. Information flows offline: safety constraint is bound with a key to produce an invariant stored externally. Online: current context is encoded as a noise vector, normalized to fixed magnitude, superimposed with the stored invariant, binarized via sign cleanup, and unbound with the original key to recover the safety signal. The recovered vector is then re-injected into context or used as a drift metric (cosine similarity) to trigger re-injection.","trained_components":["semantic encoder (bag-of-words or learned projection from sentence-transformer embeddings into bipolar space)"]},"biblio":{"authors":[],"title":"Holographic Invariant Storage: Design-Time Safety Contracts via Vector Symbolic Architectures","venue":null,"year":2026},"claims":[{"baseline":null,"claim_id":"c1","compute_reported":false,"dataset":null,"evidence":"claimed","evidence_ref":null,"metric":"cosine similarity","scale":null,"statement":"Single-signal recovery fidelity converges to 1/√2 ≈ 0.707 regardless of noise depth or content","type":"theoretical","unit":"fraction","value":0.707},{"baseline":null,"claim_id":"c2","compute_reported":false,"dataset":null,"evidence":"claimed","evidence_ref":null,"metric":"cosine similarity under Gaussian noise","scale":null,"statement":"Continuous-noise robustness follows 2Φ(1/σ) - 1, where Φ is the CDF of the standard normal","type":"theoretical","unit":null,"value":null},{"baseline":null,"claim_id":"c3","compute_reported":false,"dataset":null,"evidence":"claimed","evidence_ref":null,"metric":"cosine similarity","scale":null,"statement":"Multi-signal capacity degradation scales as √(1/(K+1)) for K bundled safety invariants","type":"theoretical","unit":null,"value":null},{"baseline":{"name":"Theorem 1 theoretical prediction","value":0.707},"claim_id":"c4","compute_reported":false,"dataset":"synthetic bipolar vectors with adversarial text noise","evidence":"claimed","evidence_ref":null,"metric":"cosine similarity","scale":{"params":null,"rungs_measured":1},"statement":"Monte Carlo simulation (n=1,000) validates convergence to theoretical bound with mean recovery fidelity 0.706 ± 0.003 (95% CI: [0.700, 0.712])","type":"quantitative","unit":"fraction","value":0.706},{"baseline":{"name":"no intervention + periodic re-prompting timer","value":null},"claim_id":"c5","compute_reported":false,"dataset":null,"evidence":"claimed","evidence_ref":null,"metric":null,"scale":{"params":7000000000.0,"rungs_measured":4},"statement":"Pilot behavioral experiment (four LLMs, 2B–7B, 720 trials): HIS re-injection improves safety adherence at 2B scale (effect size d=0.60, p<0.05, 95% CI [0.22, 0.98]), with refusal rate improvement matching a matched-frequency timer baseline","type":"qualitative","unit":null,"value":null},{"baseline":null,"claim_id":"c6","compute_reported":false,"dataset":"30-turn conversation script with 4 open-source LLMs (Gemma-2 2B, Llama-3.2 3B, Qwen-2.5 3B, Qwen-2.5 7B)","evidence":"claimed","evidence_ref":null,"metric":"refusal rate","scale":{"params":7000000000.0,"rungs_measured":4},"statement":"At 7B model scale, all safety intervention conditions saturate to ceiling (all conditions 100% refusal rate), indicating the evaluation is insufficiently challenging for well-aligned models","type":"negative","unit":"fraction","value":1.0},{"baseline":null,"claim_id":"c7","compute_reported":false,"dataset":null,"evidence":"claimed","evidence_ref":null,"metric":null,"scale":null,"statement":"HIS does not guarantee that a recovered safety instruction will be obeyed by the model—only that it can be retrieved and re-injected with known fidelity. It does not address distributional shift, reward hacking, or solve the downstream signal utilization problem where the recovered instruction competes for attention weight like any re-injected token sequence.","type":"negative","unit":null,"value":null},{"baseline":null,"claim_id":"c8","compute_reported":true,"dataset":"50-turn simulated LLM interaction with 20-entry codebook","evidence":"claimed","evidence_ref":null,"metric":"wall-clock latency and codebook retrieval accuracy","scale":{"params":null,"rungs_measured":1},"statement":"Computational overhead of HIS restoration protocol is <1 millisecond on CPU (median 0.8 ms over trials for D=8192) with 50-turn integration proof-of-concept achieving 100% codebook retrieval accuracy using a 20-entry safety codebook","type":"quantitative","unit":"milliseconds","value":0.8}],"id":"arxiv:2603.13558","identity":{"arxiv":"2603.13558","doi":null,"openalex":null,"pdf_sha256":null,"s2":null},"provenance":{"audit":{"by":null,"state":"UNAUDITED"},"extracted_at":"2026-07-09T03:47:00Z","extractor_model":"claude-haiku-4-5-20251001","prompt_sha256":"9ad194037f51cd9237f22f7acdeb8479a7170cd5b516d55dd5fdfcba9bd44dc3","source_scope":"fulltext"},"record_sha256":"9e065187f5b4d15873b502dbe60b476bf3a7e9ea6cba3f7acf4c32bce72a2241","relation_to_kernel":{"hypotheses":[],"ledger_refs":[],"note":null,"seams":[]},"reproduction":{"code_url":"https://github.com/Belverith/Aetheris-Research","weights_url":null},"schema_version":"kot-lit/1"}
