{"architecture":{"frozen_components":["LLM encoder (for embedding observations)","generative LLM (for fallback selection reasoning)"],"mechanism_tags":["anomaly-detection","embedding-classifier","fallback-selection","model-predictive-control","runtime-monitor","safety-verification"],"seam_cell":"text","summary":"A two-stage reasoning framework for robotic anomaly detection and reactive planning. Stage 1: a fast binary anomaly classifier operating in LLM embedding space, which may trigger Stage 2: a slower generative LLM fallback selection stage. Both stages feed into a model predictive control (MPC) strategy that maintains feasibility of multiple fallback plans to account for the slow reasoner's latency, ensuring safety during anomaly response.","trained_components":["fast binary anomaly classifier (in LLM embedding space)"]},"biblio":{"authors":["Rohan Sinha","Amine Elhafsi","Christopher Agia","Matt Foutter","Edward Schmerling","Marco Pavone"],"citation_count":{"as_of":"2026-07-09","source":"openalex","value":29},"title":"Real-Time Anomaly Detection and Reactive Planning with Large Language Models","venue":null,"year":2024},"claims":[{"baseline":{"name":"autoregressive reasoning with state-of-the-art GPT models","value":null},"claim_id":"c1","compute_reported":false,"dataset":null,"evidence":"claimed","evidence_ref":null,"metric":null,"scale":null,"statement":"Fast anomaly classifier outperforms autoregressive reasoning with state-of-the-art GPT models, even when instantiated with relatively small language models","type":"qualitative","unit":null,"value":null},{"baseline":null,"claim_id":"c2","compute_reported":false,"dataset":null,"evidence":"claimed","evidence_ref":null,"metric":null,"scale":null,"statement":"Two-stage framework with MPC strategy maintains joint feasibility of continuing along various fallback plans to account for slow reasoner's latency as soon as an anomaly is detected, thus ensuring safety","type":"qualitative","unit":null,"value":null},{"baseline":null,"claim_id":"c3","compute_reported":false,"dataset":null,"evidence":"claimed","evidence_ref":null,"metric":null,"scale":null,"statement":"Runtime monitor improves the trustworthiness of dynamic robotic systems, such as quadrotors or autonomous vehicles, under resource and time constraints","type":"qualitative","unit":null,"value":null},{"baseline":null,"claim_id":"c4","compute_reported":false,"dataset":null,"evidence":"claimed","evidence_ref":null,"metric":null,"scale":null,"statement":"Fast binary anomaly classifier mitigates computational expense of LLMs such that they may be applied online to robotic systems","type":"qualitative","unit":null,"value":null}],"id":"doi:10.15607/rss.2024.xx.114","identity":{"arxiv":null,"doi":"10.15607/rss.2024.xx.114","openalex":"W4402354012","pdf_sha256":null,"s2":null},"provenance":{"audit":{"by":null,"state":"UNAUDITED"},"extracted_at":"2026-07-09T13:28:50Z","extractor_model":"claude-haiku-4-5-20251001","prompt_sha256":"9ad194037f51cd9237f22f7acdeb8479a7170cd5b516d55dd5fdfcba9bd44dc3","source_scope":"abstract-only"},"record_sha256":"bf50d4a31707cbf6765732dd6545df5351111d2890986d37530229b5a63f4e09","relation_to_kernel":{"hypotheses":[],"ledger_refs":[],"note":null,"seams":[]},"reproduction":{"code_url":null,"weights_url":null},"schema_version":"kot-lit/1"}
