{"architecture":{"frozen_components":["Llama-3.1-8B","Gemma-2-9B"],"mechanism_tags":["sae","feature-suppression","activation-intervention","uncertainty-calibration","ablation","interpretability"],"seam_cell":"own-activations","summary":"The system uses sparse autoencoders (SAEs) applied to internal activations of Llama-3.1-8B and Gemma-2-9B to identify and classify feature populations by their functional role along two independent dimensions: correctness and confidence. A 2×2 partitioning framework categorizes model predictions, SAEs extract features for each quadrant independently, and targeted suppression of identified features measures their causal contribution to accuracy and entropy. Features are categorized as pure uncertainty, pure incorrectness, or confounded; suppression experiments and selective abstention via learned classifiers form the central mechanism.","trained_components":["sparse autoencoders (SAE dictionary)","correctness prediction classifier (3-feature AUROC model)"]},"biblio":{"authors":["Het Patel","Tiejin Chen","Hua Wei","Evangelos E. Papalexakis","Jia Chen"],"citation_count":{"as_of":"2026-07-09","source":"openalex","value":0},"title":"Are LLM Uncertainty and Correctness Encoded by the Same Features? A Functional Dissociation via Sparse Autoencoders","venue":"arXiv (Cornell University)","year":2026},"claims":[{"baseline":null,"claim_id":"c1","compute_reported":false,"dataset":null,"evidence":"claimed","evidence_ref":null,"metric":null,"scale":null,"statement":"Pure uncertainty features are functionally essential: suppressing them severely degrades accuracy","type":"qualitative","unit":null,"value":null},{"baseline":null,"claim_id":"c2","compute_reported":false,"dataset":null,"evidence":"claimed","evidence_ref":null,"metric":null,"scale":null,"statement":"Pure incorrectness features are functionally inert: despite showing statistically significant activation differences between correct and incorrect predictions, the majority produce near-zero change in accuracy when suppressed","type":"qualitative","unit":null,"value":null},{"baseline":null,"claim_id":"c3","compute_reported":false,"dataset":"ARC-Challenge and RACE","evidence":"claimed","evidence_ref":null,"metric":"accuracy improvement and entropy reduction","scale":{"params":9000000000.0,"rungs_measured":2},"statement":"Targeted suppression of confounded features yields a 1.1% accuracy improvement and a 75% entropy reduction, with effects transferring across the ARC-Challenge and RACE benchmarks","type":"quantitative","unit":"percent","value":1.1},{"baseline":null,"claim_id":"c4","compute_reported":false,"dataset":null,"evidence":"claimed","evidence_ref":null,"metric":null,"scale":{"params":9000000000.0,"rungs_measured":1},"statement":"The activations of just 3 confounded features from a single mid-network layer predict model correctness (AUROC ~0.79)","type":"qualitative","unit":null,"value":null},{"baseline":{"name":"baseline accuracy without abstention","value":62},"claim_id":"c5","compute_reported":false,"dataset":null,"evidence":"claimed","evidence_ref":null,"metric":null,"scale":{"params":9000000000.0,"rungs_measured":1},"statement":"Selective abstention using the 3-feature correctness predictor raises accuracy from 62% to 81% at 53% coverage","type":"qualitative","unit":"percent","value":null},{"baseline":null,"claim_id":"c6","compute_reported":false,"dataset":null,"evidence":"claimed","evidence_ref":null,"metric":null,"scale":null,"statement":"Uncertainty and correctness are distinct internal phenomena, encoded by separate feature populations rather than the same mechanisms","type":"theoretical","unit":null,"value":null}],"id":"url:openalex-w7155573845","identity":{"arxiv":null,"doi":null,"openalex":"W7155573845","pdf_sha256":null,"s2":null},"provenance":{"audit":{"by":null,"state":"UNAUDITED"},"extracted_at":"2026-07-09T13:33:30Z","extractor_model":"claude-haiku-4-5-20251001","prompt_sha256":"9ad194037f51cd9237f22f7acdeb8479a7170cd5b516d55dd5fdfcba9bd44dc3","source_scope":"abstract-only"},"record_sha256":"7d7d3e487bd35550253b1047bd7858387be52b001db36c8d37399d74efb803a9","relation_to_kernel":{"hypotheses":[],"ledger_refs":[],"note":null,"seams":[]},"reproduction":{"code_url":null,"weights_url":null},"schema_version":"kot-lit/1"}
