{"architecture":{"frozen_components":[],"mechanism_tags":["neural-symbolic","logic-programming","stochastic-inference","grammar-rules","end-to-end-training"],"seam_cell":"trained-bridge","summary":"DeepStochLog extends stochastic definite clause grammars (a kind of stochastic logic program) with neural predicates (grammar rules). The system performs end-to-end training by integrating learned neural components into a symbolic inference engine. Information flows from input through neural rule evaluations embedded in the logic program's clause derivations, enabling joint neural-symbolic inference and learning.","trained_components":["neural grammar rules","neural predicates"]},"biblio":{"authors":["Thomas Winters","Giuseppe Marra","Robin Manhaeve","Luc De Raedt"],"citation_count":{"as_of":"2026-07-09","source":"openalex","value":34},"title":"DeepStochLog: Neural Stochastic Logic Programming","venue":"Proceedings of the AAAI Conference on Artificial Intelligence","year":2022},"claims":[{"baseline":{"name":"DeepProbLog","value":null},"claim_id":"c1","compute_reported":false,"dataset":null,"evidence":"claimed","evidence_ref":null,"metric":null,"scale":null,"statement":"inference and learning in neural stochastic logic programming scale much better than for neural probabilistic logic programs","type":"qualitative","unit":null,"value":null},{"baseline":null,"claim_id":"c2","compute_reported":false,"dataset":null,"evidence":"claimed","evidence_ref":null,"metric":null,"scale":null,"statement":"DeepStochLog achieves state-of-the-art results on challenging neural-symbolic learning tasks","type":"qualitative","unit":null,"value":null}],"id":"doi:10.1609/aaai.v36i9.21248","identity":{"arxiv":null,"doi":"10.1609/aaai.v36i9.21248","openalex":"W3176736844","pdf_sha256":null,"s2":null},"provenance":{"audit":{"by":null,"state":"UNAUDITED"},"extracted_at":"2026-07-09T13:31:06Z","extractor_model":"claude-haiku-4-5-20251001","prompt_sha256":"9ad194037f51cd9237f22f7acdeb8479a7170cd5b516d55dd5fdfcba9bd44dc3","source_scope":"abstract-only"},"record_sha256":"7c9fb92257c61609f2691e9ebacf5fdf97358b7c8ce20d357c646fa27233cfb1","relation_to_kernel":{"hypotheses":[],"ledger_refs":[],"note":null,"seams":[]},"reproduction":{"code_url":null,"weights_url":null},"schema_version":"kot-lit/1"}
