{"architecture":{"frozen_components":["base instruction-tuned LLM parameters (except embeddings for abstract tokens)"],"mechanism_tags":["discrete-latent-reasoning","abstract-vocabulary","constrained-decoding","policy-iteration","warm-up-rl","information-bottleneck","self-distillation"],"seam_cell":"trained-bridge","summary":"Abstract Chain-of-Thought augments decoder-only LLMs with a reserved vocabulary of abstract tokens that function as discrete latent reasoning traces. During inference, the model generates a bounded sequence of abstract tokens (instead of natural language CoT) before producing a response. Information flows: prompt → abstract token sequence (constrained decoding) → response. The abstract tokens are trained via a two-stage pipeline: (1) policy iteration warm-up alternating between bottlenecked SFT (where response attends only to prompt and abstract tokens, not verbal CoT) and self-distillation without verbal guidance, and (2) warm-started RL (GRPO with constrained decoding) to refine abstract sequence generation.","trained_components":["abstract token embeddings (randomly initialized, learned during warm-up and RL)","bottlenecked attention mask enforcement (block-structured masking)","abstract sequence generation policy (constrained to reserved vocabulary)","response generation conditioned on abstract tokens"]},"biblio":{"authors":[],"title":"Thinking Without Words: Efficient Latent Reasoning with Abstract Chain-of-Thought","venue":null,"year":2026},"claims":[{"baseline":{"name":"verbal CoT (SFT + RL)","value":null},"claim_id":"c1","compute_reported":false,"dataset":"MATH-500","evidence":"claimed","evidence_ref":null,"metric":"token compression ratio","scale":{"params":8000000000.0,"rungs_measured":3},"statement":"Abstract-CoT achieves up to 11.6× fewer reasoning tokens while demonstrating comparable performance across mathematical reasoning, instruction-following, and multi-hop reasoning","type":"quantitative","unit":"x","value":11.6},{"baseline":{"name":"SFT + RL (verbal CoT)","value":92.6},"claim_id":"c2","compute_reported":false,"dataset":"MATH-500","evidence":"claimed","evidence_ref":null,"metric":"accuracy / token count","scale":{"params":8000000000.0,"rungs_measured":1},"statement":"On MATH-500 with Qwen3-8B, Abstract-CoT (Warm-up + RL) achieves 90.8% accuracy with 144 tokens, compared to SFT + RL baseline of 92.6% accuracy with 1671 tokens","type":"quantitative","unit":"percent / tokens","value":90.8},{"baseline":{"name":"SFT + RL (verbal CoT)","value":58.4},"claim_id":"c3","compute_reported":false,"dataset":"AlpacaEval-LC-2.0","evidence":"claimed","evidence_ref":null,"metric":"win-rate / token count","scale":{"params":8000000000.0,"rungs_measured":1},"statement":"On AlpacaEval with Qwen3-8B, Abstract-CoT (Warm-up + RL) achieves 60.8 win-rate with 225 tokens, outperforming SFT + RL baseline of 58.4 win-rate with 496 tokens","type":"quantitative","unit":"percent / tokens","value":60.8},{"baseline":{"name":"SFT + RL (verbal CoT)","value":58.1},"claim_id":"c4","compute_reported":false,"dataset":"HotpotQA (500 samples)","evidence":"claimed","evidence_ref":null,"metric":"F1 / token count","scale":{"params":8000000000.0,"rungs_measured":1},"statement":"On HotpotQA with Qwen3-8B, Abstract-CoT (Warm-up + RL) achieves 58.8 F1 with 171 tokens, compared to SFT + RL baseline of 58.1 F1 with 735 tokens","type":"quantitative","unit":"points / tokens","value":58.8},{"baseline":{"name":"verbal CoT (SFT + RL) for each model","value":null},"claim_id":"c5","compute_reported":false,"dataset":null,"evidence":"claimed","evidence_ref":null,"metric":null,"scale":{"params":8000000000.0,"rungs_measured":3},"statement":"Abstract-CoT generalizes across model families: on MATH-500, Qwen3-4B achieves 89.8% accuracy with 141 tokens and Granite 4.0 Micro (3B) achieves 74.4% accuracy with 153 tokens, both substantially reducing tokens compared to their verbal CoT baselines","type":"qualitative","unit":null,"value":null},{"baseline":null,"claim_id":"c6","compute_reported":false,"dataset":null,"evidence":"claimed","evidence_ref":null,"metric":null,"scale":null,"statement":"An emergent power law distribution over the abstract vocabulary is observed during RL training, evolving across the training phases, with a single dominant token leveraged across diverse settings and token usage converging to a Zipf-like distribution","type":"qualitative","unit":null,"value":null},{"baseline":null,"claim_id":"c7","compute_reported":false,"dataset":"MATH-500, AlpacaEval, HotpotQA","evidence":"claimed","evidence_ref":null,"metric":null,"scale":null,"statement":"Performing cold-start RL without warm-up is insufficient and often underperforms the base instruction-tuned model; warm-up alone lags behind SFT with verbal CoT on most benchmarks","type":"negative","unit":null,"value":null},{"baseline":null,"claim_id":"c8","compute_reported":false,"dataset":"MATH-500","evidence":"claimed","evidence_ref":null,"metric":null,"scale":null,"statement":"Permutation ablation shows that abstract sequences exhibit learned compositional behavior: permuting abstract tokens at the token level reduces performance, with smaller performance drops than for verbal CoT permutation, indicating discrete ordering structure in the abstract reasoning language","type":"qualitative","unit":null,"value":null}],"id":"arxiv:2604.22709","identity":{"arxiv":"2604.22709","doi":null,"openalex":null,"pdf_sha256":null,"s2":null},"provenance":{"audit":{"by":null,"state":"UNAUDITED"},"extracted_at":"2026-07-09T03:48:28Z","extractor_model":"claude-haiku-4-5-20251001","prompt_sha256":"9ad194037f51cd9237f22f7acdeb8479a7170cd5b516d55dd5fdfcba9bd44dc3","source_scope":"fulltext"},"record_sha256":"79167d9de3255b43748f5db77db440d4712403cb2f6d576c2f9dbe71b4877d18","relation_to_kernel":{"hypotheses":[],"ledger_refs":[],"note":null,"seams":[]},"reproduction":{"code_url":null,"weights_url":null},"schema_version":"kot-lit/1"}
