{"architecture":{"frozen_components":["transformer LLM parameters","pre-trained model weights"],"mechanism_tags":["task-vector-extraction","activation-patching","hypothesis-class-decomposition","icl-mechanistic"],"seam_cell":"own-activations","summary":"The paper proposes that in-context learning (ICL) in transformer LLMs can be decomposed into two components: a learning algorithm ℒ that compresses a training set S into a query-agnostic task vector θ(S), and a rule-application function ℛ that applies θ to a query x to produce output, without direct dependence on S. The mechanism extracts θ from intermediate hidden states (at a learned layer ℓ*) using a dummy query, then patches θ back into a forward pass of the transformer run only on x, preventing ℛ from directly accessing S while maintaining ICL accuracy.","trained_components":[]},"biblio":{"authors":["Roee Hendel","Mor Geva","Amir Globerson"],"citation_count":{"as_of":"2026-07-09","source":"openalex","value":4},"title":"In-Context Learning Creates Task Vectors","venue":"arXiv (Cornell University)","year":2023},"claims":[{"baseline":null,"claim_id":"c1","compute_reported":false,"dataset":null,"evidence":"claimed","evidence_ref":null,"metric":null,"scale":null,"statement":"ICL can be viewed as compressing a training set S into a single task vector θ(S) calculated from S, which then modulates the transformer to produce output","type":"qualitative","unit":null,"value":null},{"baseline":{"name":"Regular ICL forward pass","value":null},"claim_id":"c2","compute_reported":false,"dataset":"18 tasks across algorithmic, translation, linguistic, and knowledge categories","evidence":"claimed","evidence_ref":null,"metric":"accuracy retention","scale":{"params":30000000000.0,"rungs_measured":7},"statement":"The hypothesis-based procedure (extracting θ and applying ℛ with patching) maintains around 80-90% of the accuracy of regular ICL","type":"quantitative","unit":"fraction","value":0.85},{"baseline":null,"claim_id":"c3","compute_reported":false,"dataset":"18 tasks across algorithmic, translation, linguistic, and knowledge categories","evidence":"claimed","evidence_ref":null,"metric":"accuracy","scale":{"params":30000000000.0,"rungs_measured":7},"statement":"The baseline (forward pass on query x alone, without demonstrations or task vector) reaches only 10-20% accuracy","type":"quantitative","unit":"fraction","value":0.15},{"baseline":null,"claim_id":"c4","compute_reported":false,"dataset":"LLaMA 7B, 50 task vectors per task with varied S and dummy queries","evidence":"claimed","evidence_ref":null,"metric":null,"scale":null,"statement":"Task vectors form distinct clusters in embedding space, with vectors from the same task closer together than vectors from different tasks, indicating stability of θ across variations in S and dummy query","type":"qualitative","unit":null,"value":null},{"baseline":null,"claim_id":"c5","compute_reported":false,"dataset":"Conflicting task pairs (e.g. Next Letter vs To Upper, List Last vs List First)","evidence":"claimed","evidence_ref":null,"metric":null,"scale":null,"statement":"When conflicting task vectors are injected during forward pass, the model achieves high accuracy on the injected task while largely disregarding the original demonstrations, showing that ℛ mainly relies on θ rather than directly accessing S","type":"qualitative","unit":null,"value":null},{"baseline":null,"claim_id":"c6","compute_reported":false,"dataset":"vocabulary projection on LLaMA 13B and other models across all 18 tasks","evidence":"claimed","evidence_ref":null,"metric":null,"scale":null,"statement":"Task vectors project onto interpretable tokens that semantically describe the task (e.g. 'English', 'translate' for French-to-English translation) without these terms appearing explicitly in the context","type":"qualitative","unit":null,"value":null},{"baseline":null,"claim_id":"c7","compute_reported":false,"dataset":"LLaMA 7B/13B/30B, GPT-J 6B, Pythia 2.8B/6.9B/12B","evidence":"claimed","evidence_ref":null,"metric":null,"scale":null,"statement":"The intermediate layer ℓ* where θ is extracted exhibits a consistent performance peak across models of different sizes and layer counts, despite architectural differences","type":"qualitative","unit":null,"value":null},{"baseline":null,"claim_id":"c8","compute_reported":false,"dataset":null,"evidence":"claimed","evidence_ref":null,"metric":null,"scale":null,"statement":"The paper studies relatively simple tasks with single-token outputs; it remains unclear whether the task vector mechanism generalizes to more complex ICL cases (e.g. arithmetic reasoning, multi-token outputs) that may require more elaborate parameterization","type":"negative","unit":null,"value":null}],"id":"arxiv:2310.15916","identity":{"arxiv":"2310.15916","doi":null,"openalex":"W4387947500","pdf_sha256":null,"s2":null},"provenance":{"audit":{"by":null,"state":"UNAUDITED"},"extracted_at":"2026-07-09T03:37:57Z","extractor_model":"claude-haiku-4-5-20251001","prompt_sha256":"9ad194037f51cd9237f22f7acdeb8479a7170cd5b516d55dd5fdfcba9bd44dc3","source_scope":"fulltext"},"record_sha256":"42997ed90c7cb0bb8a54cc179c40cc235d584030a866e9eaae1ab0cde1641970","relation_to_kernel":{"hypotheses":[],"ledger_refs":[],"note":null,"seams":[]},"reproduction":{"code_url":"https://github.com/roeehendel/icl_task_vectors","weights_url":null},"schema_version":"kot-lit/1"}
