{"architecture":{"frozen_components":["MLLM backbone (inference-time weights fixed during RL)"],"mechanism_tags":["reinforcement-learning","intermediate-state-verification","spatial-reasoning","multimodal-chain-of-thought","reward-design"],"seam_cell":"own-activations","summary":"SVoT is a reinforcement learning framework that augments multimodal large language models (MLLMs) with interleaved text and visual reasoning over spatial state sequences. The model generates intermediate states (text descriptions and visualizations) alongside transition reasoning chains, enabling verification of action preconditions and effects. A trained reward function evaluates the correctness of generated states and transitions. The MLLM backbone is fine-tuned via Group Relative Policy Optimization (GRPO) to maximize rewards that capture both state accuracy and transition validity.","trained_components":["reward function for state and transition verification","MLLM policy via GRPO","visualization generation component"]},"biblio":{"authors":["Chao Lei","Yanbei Jiang","M. Hiller","Zhijian Zhou","Xunye Tian","Krista A. Ehinger","Nir Lipovetzky"],"citation_count":{"as_of":"2026-07-09","source":"openalex","value":0},"title":"SVoT: State-aware Visualization-of-Thought for Spatial Reasoning via Reinforcement Learning","venue":"arXiv (Cornell University)","year":2026},"claims":[{"baseline":null,"claim_id":"c1","compute_reported":false,"dataset":"out-of-distribution test sets across five spatial reasoning domains","evidence":"claimed","evidence_ref":null,"metric":"absolute accuracy gain","scale":null,"statement":"SVoT with transition-aware supervision achieves state-of-the-art performance across the introduced domains, yielding up to a 65% absolute accuracy gain on out-of-distribution test sets.","type":"quantitative","unit":"percent","value":65},{"baseline":null,"claim_id":"c2","compute_reported":false,"dataset":null,"evidence":"claimed","evidence_ref":null,"metric":null,"scale":null,"statement":"SVoT integrates transition reasoning chains into the generation processes, enabling the model to verify action preconditions and effects through interleaved textual and visual reasoning.","type":"qualitative","unit":null,"value":null},{"baseline":null,"claim_id":"c3","compute_reported":false,"dataset":null,"evidence":"claimed","evidence_ref":null,"metric":null,"scale":null,"statement":"SVoT generates interleaved, verifiable intermediate states and visualizations to enable reliable multi-hop inference over both intermediate states and state transitions.","type":"qualitative","unit":null,"value":null},{"baseline":null,"claim_id":"c4","compute_reported":false,"dataset":null,"evidence":"claimed","evidence_ref":null,"metric":null,"scale":null,"statement":"Current studies often leave intermediate states unverified and treat state transitions as implicit processes, which limits reliability in multi-hop spatial reasoning.","type":"negative","unit":null,"value":null},{"baseline":null,"claim_id":"c5","compute_reported":false,"dataset":null,"evidence":"claimed","evidence_ref":null,"metric":null,"scale":null,"statement":"Existing benchmarks reduce state transitions to single-variable updates, substantially simplifying the problems.","type":"negative","unit":null,"value":null},{"baseline":null,"claim_id":"c6","compute_reported":false,"dataset":null,"evidence":"claimed","evidence_ref":null,"metric":null,"scale":null,"statement":"Five domains are established by extending classical environments and introducing two novel domains, Pacman and Gather, that require multi-object interactions and numerical reasoning.","type":"qualitative","unit":null,"value":null}],"id":"url:openalex-w7164614390","identity":{"arxiv":null,"doi":null,"openalex":"W7164614390","pdf_sha256":null,"s2":null},"provenance":{"audit":{"by":null,"state":"UNAUDITED"},"extracted_at":"2026-07-09T13:35:01Z","extractor_model":"claude-haiku-4-5-20251001","prompt_sha256":"9ad194037f51cd9237f22f7acdeb8479a7170cd5b516d55dd5fdfcba9bd44dc3","source_scope":"abstract-only"},"record_sha256":"2124ae5d8961f1d99ca5c9da1c1c40e7419d5a96f96a07cbe36bb14a0fc5cb51","relation_to_kernel":{"hypotheses":[],"ledger_refs":[],"note":null,"seams":[]},"reproduction":{"code_url":null,"weights_url":null},"schema_version":"kot-lit/1"}
