{"architecture":{"frozen_components":[],"mechanism_tags":["interleaved-reasoning","reinforcement-learning","process-rewards","curriculum-learning","medical-imaging","verifiable-supervision"],"seam_cell":"text","summary":"CX-Mind is a multimodal large language model for chest X-ray diagnosis that interleaves visual encoding with stepwise reasoning via a \"think-answer\" decoding pattern. The system encodes CXR images and generates structured reasoning steps followed by diagnostic answers, trained end-to-end using curriculum-guided reinforcement learning with verifiable process rewards. Information flows from image → multimodal encoder → token sequence with embedded reasoning checkpoints → policy-optimized decoding under Group Relative Policy Optimization (GRPO), with rule-based conditional rewards supervising intermediate reasoning quality without a separate learned reward model.","trained_components":["MLLM encoder (vision + language backbone)","GRPO policy parameters for interleaved reasoning decoding","instruction-tuning head fine-tuned on CX-Set"]},"biblio":{"authors":["Wenjie Li","Yujie Zhang","Haoran Sun","Yueqi Li","Fanrui Zhang","Mengzhe Xu","Victoria Borja Clausich","Sade Mellin","Renhao Yang","Chenrun Wang","Jethro Zih-Shuo Wang","Shiyi Yao"],"citation_count":{"as_of":"2026-07-09","source":"openalex","value":2},"title":"CX-Mind: a pioneering multimodal large language model for interleaved reasoning in chest X-ray via curriculum-guided reinforcement learning","venue":"Information Fusion","year":2025},"claims":[{"baseline":{"name":"comparable CXR-specific models","value":null},"claim_id":"c1","compute_reported":false,"dataset":null,"evidence":"claimed","evidence_ref":null,"metric":null,"scale":null,"statement":"CX-Mind achieves an average performance improvement of 25.1% over comparable CXR-specific models","type":"qualitative","unit":"percent","value":null},{"baseline":{"name":"second-best model","value":null},"claim_id":"c2","compute_reported":false,"dataset":null,"evidence":"claimed","evidence_ref":null,"metric":null,"scale":null,"statement":"On a real-world clinical dataset (Rui-CXR), CX-Mind achieves a mean recall@1 across 14 diseases that substantially surpasses the second-best results","type":"qualitative","unit":null,"value":null},{"baseline":{"name":"existing medical and general-domain MLLMs","value":null},"claim_id":"c3","compute_reported":false,"dataset":null,"evidence":"claimed","evidence_ref":null,"metric":null,"scale":null,"statement":"CX-Mind significantly outperforms existing medical and general-domain MLLMs in visual understanding, text generation, and spatiotemporal alignment","type":"qualitative","unit":null,"value":null},{"baseline":null,"claim_id":"c4","compute_reported":false,"dataset":null,"evidence":"claimed","evidence_ref":null,"metric":null,"scale":null,"statement":"Multi-center expert evaluations confirm clinical utility across multiple dimensions","type":"qualitative","unit":null,"value":null},{"baseline":null,"claim_id":"c5","compute_reported":false,"dataset":"CX-Set (subset)","evidence":"claimed","evidence_ref":null,"metric":null,"scale":null,"statement":"Generated 42,828 high-quality interleaved reasoning data points supervised by clinical reports","type":"qualitative","unit":null,"value":null},{"baseline":null,"claim_id":"c6","compute_reported":false,"dataset":"CX-Set","evidence":"claimed","evidence_ref":null,"metric":null,"scale":null,"statement":"Constructed instruction-tuning dataset CX-Set comprising 708,473 images and 2,619,148 samples","type":"qualitative","unit":null,"value":null},{"baseline":null,"claim_id":"c7","compute_reported":false,"dataset":null,"evidence":"claimed","evidence_ref":null,"metric":null,"scale":null,"statement":"Existing multimodal models predominantly rely on 'one-time' diagnostic approaches, lacking verifiable supervision of the reasoning process, leading to lengthy reasoning, sparse rewards, and frequent hallucinations","type":"negative","unit":null,"value":null},{"baseline":null,"claim_id":"c8","compute_reported":false,"dataset":null,"evidence":"claimed","evidence_ref":null,"metric":null,"scale":null,"statement":"Optimization conducted in two stages under GRPO framework: initially stabilizing basic reasoning with closed-domain tasks, followed by transfer to open-domain diagnostics, incorporating rule-based conditional process rewards to bypass the need for pretrained reward models","type":"qualitative","unit":null,"value":null}],"id":"doi:10.1016/j.inffus.2025.104027","identity":{"arxiv":null,"doi":"10.1016/j.inffus.2025.104027","openalex":"W4417013833","pdf_sha256":null,"s2":null},"provenance":{"audit":{"by":null,"state":"UNAUDITED"},"extracted_at":"2026-07-09T13:28:33Z","extractor_model":"claude-haiku-4-5-20251001","prompt_sha256":"9ad194037f51cd9237f22f7acdeb8479a7170cd5b516d55dd5fdfcba9bd44dc3","source_scope":"abstract-only"},"record_sha256":"00cefabe427e0e0d77aead61ab14642f0b0a96585a5125120f0d60b8117e1c72","relation_to_kernel":{"hypotheses":[],"ledger_refs":[],"note":null,"seams":[]},"reproduction":{"code_url":null,"weights_url":null},"schema_version":"kot-lit/1"}
