{"architecture":{"frozen_components":["LLM backbone"],"mechanism_tags":["kg-injection","contrastive-learning","lora-adaptation","retrieval-augmentation","link-prediction"],"seam_cell":"trained-bridge","summary":"SLiNT injects knowledge graph structural context into a frozen LLM backbone via three modular components: (1) Structure-Guided Neighborhood Enhancement (SGNE) retrieves pseudo-neighbors as text to enrich sparse entity representations; (2) Dynamic Hard Contrastive Learning (DHCL) applies entity-level contrastive supervision with interpolated hard positives/negatives; (3) Gradient-Decoupled Dual Injection (GDDI) performs token-level structural intervention via LoRA adapters while keeping core LLM parameters frozen. Information flows from KG structure → text-enriched prompts → LLM → contrastive loss supervision → adapted representations for link prediction.","trained_components":["LoRA adapters for structure-aware intervention","contrastive learning objective (DHCL)","pseudo-neighbor retrieval weights (SGNE)"]},"biblio":{"authors":["Mengxue Yang","Chun Yang","Jiaqi Zhu","Jiafan Li","Jingqi Zhang","Yuyang Li","Ying Li"],"citation_count":{"as_of":"2026-07-09","source":"openalex","value":0},"title":"SLiNT: Structure-aware Language Model with Injection and Contrastive Training for Knowledge Graph Completion","venue":null,"year":2025},"claims":[{"baseline":{"name":"embedding-based and generation-based baselines","value":null},"claim_id":"c1","compute_reported":false,"dataset":"WN18RR and FB15k-237","evidence":"claimed","evidence_ref":null,"metric":null,"scale":null,"statement":"SLiNT achieves superior or competitive performance compared with both embedding-based and generation-based baselines on knowledge graph link prediction","type":"qualitative","unit":null,"value":null},{"baseline":null,"claim_id":"c2","compute_reported":false,"dataset":null,"evidence":"claimed","evidence_ref":null,"metric":null,"scale":null,"statement":"Structure-Guided Neighborhood Enhancement (SGNE) retrieves pseudo-neighbors to enrich sparse entities and mitigate missing context","type":"qualitative","unit":null,"value":null},{"baseline":null,"claim_id":"c3","compute_reported":false,"dataset":null,"evidence":"claimed","evidence_ref":null,"metric":null,"scale":null,"statement":"Dynamic Hard Contrastive Learning (DHCL) introduces fine-grained supervision by interpolating hard positives and negatives to resolve entity-level ambiguity","type":"qualitative","unit":null,"value":null},{"baseline":null,"claim_id":"c4","compute_reported":false,"dataset":null,"evidence":"claimed","evidence_ref":null,"metric":null,"scale":null,"statement":"Gradient-Decoupled Dual Injection (GDDI) performs token-level structure-aware intervention while preserving the core LLM parameters","type":"qualitative","unit":null,"value":null},{"baseline":null,"claim_id":"c5","compute_reported":false,"dataset":null,"evidence":"claimed","evidence_ref":null,"metric":null,"scale":null,"statement":"LLMs' limited exploitation of structural signals often results in structural sparsity and semantic ambiguity, especially under incomplete or zero-shot settings","type":"qualitative","unit":null,"value":null}],"id":"doi:10.18653/v1/2025.findings-emnlp.736","identity":{"arxiv":null,"doi":"10.18653/v1/2025.findings-emnlp.736","openalex":"W4416034878","pdf_sha256":null,"s2":null},"provenance":{"audit":{"by":null,"state":"UNAUDITED"},"extracted_at":"2026-07-09T03:24:31Z","extractor_model":"claude-haiku-4-5-20251001","prompt_sha256":"9ad194037f51cd9237f22f7acdeb8479a7170cd5b516d55dd5fdfcba9bd44dc3","source_scope":"abstract-only"},"record_sha256":"4be9aac92c67ff7b88ff3079aa7a6ebf63b11731481eb66bd3398ab1eaadb1e3","relation_to_kernel":{"hypotheses":[],"ledger_refs":[],"note":null,"seams":[]},"reproduction":{"code_url":null,"weights_url":null},"schema_version":"kot-lit/1"}
