{"architecture":{"frozen_components":["LLM (inference-only)","Lean 4 formal prover (off-the-shelf)"],"mechanism_tags":["formal-verification","verifier-loop","step-aware-checking","lean-4-proof","hallucination-detection","interpretability"],"seam_cell":"external-engine","summary":"Safe is a retrospective step-aware formal verification framework that intercepts CoT reasoning steps from LLMs, translates mathematical claims into formal language (Lean 4), and uses a formal theorem prover to verify each step's correctness. Information flows: LLM generates CoT → claims extracted and formalized in Lean 4 → formal prover checks validity → verification result returned to filter/rank reasoning paths. The system treats formal proofs as ground truth for hallucination detection, replacing opaque scoring (PRM/self-consistency) with checkable evidence.","trained_components":[]},"biblio":{"authors":["Chengwu Liu","Ye Yuan","Yichun Yin","Yan Xu","Xin Xu","Zaoyu Chen","Yasheng Wang","Lifeng Shang","Qun Liu","Ming Zhang"],"citation_count":{"as_of":"2026-07-09","source":"openalex","value":1},"title":"Safe: Enhancing Mathematical Reasoning in Large Language Models via Retrospective Step-aware Formal Verification","venue":null,"year":2025},"claims":[{"baseline":null,"claim_id":"c1","compute_reported":false,"dataset":null,"evidence":"claimed","evidence_ref":null,"metric":null,"scale":null,"statement":"Safe provides interpretable and verifiable evidence for mathematical reasoning, in contrast to opaque methods like process reward models or self-consistency","type":"qualitative","unit":null,"value":null},{"baseline":null,"claim_id":"c2","compute_reported":false,"dataset":null,"evidence":"claimed","evidence_ref":null,"metric":null,"scale":null,"statement":"The framework translates mathematical claims at each reasoning step into formal mathematical language Lean 4 and provides formal proofs to identify hallucinations","type":"qualitative","unit":null,"value":null},{"baseline":null,"claim_id":"c3","compute_reported":false,"dataset":"FormalStep","evidence":"claimed","evidence_ref":null,"metric":"statement count","scale":null,"statement":"FormalStep benchmark comprises 30,809 formal statements for step correctness theorem proving","type":"quantitative","unit":"statements","value":30809},{"baseline":null,"claim_id":"c4","compute_reported":false,"dataset":null,"evidence":"claimed","evidence_ref":null,"metric":null,"scale":null,"statement":"Safe demonstrates significant performance improvement across multiple language models and various mathematical datasets","type":"qualitative","unit":null,"value":null},{"baseline":null,"claim_id":"c5","compute_reported":false,"dataset":null,"evidence":"claimed","evidence_ref":null,"metric":null,"scale":null,"statement":"This is the first endeavor to utilize formal mathematical language Lean 4 for verifying content generated by LLMs","type":"qualitative","unit":null,"value":null}],"id":"doi:10.18653/v1/2025.acl-long.594","identity":{"arxiv":null,"doi":"10.18653/v1/2025.acl-long.594","openalex":"W4412945351","pdf_sha256":null,"s2":null},"provenance":{"audit":{"by":null,"state":"UNAUDITED"},"extracted_at":"2026-07-09T13:29:31Z","extractor_model":"claude-haiku-4-5-20251001","prompt_sha256":"9ad194037f51cd9237f22f7acdeb8479a7170cd5b516d55dd5fdfcba9bd44dc3","source_scope":"abstract-only"},"record_sha256":"a91c124f28d503f44639fd2b2ecd5974b9a324a3cebdb509bb3d042d32a1efe3","relation_to_kernel":{"hypotheses":[],"ledger_refs":[],"note":null,"seams":[]},"reproduction":{"code_url":null,"weights_url":null},"schema_version":"kot-lit/1"}
